{
  "$schema": "https://json-schema.org/draft/2020-12/schema",
  "$id": "https://awg.local/contracts/agents/observation.schema.json",
  "title": "Observation",
  "type": "object",
  "properties": {
    "schema_version": {
      "type": "string"
    },
    "observation_id": {
      "type": "string"
    },
    "observer_id": {
      "type": "string"
    },
    "source_event_id": {
      "type": [
        "string",
        "null"
      ]
    },
    "channel": {
      "type": "string"
    },
    "observed_at": {
      "type": "string",
      "format": "date-time"
    },
    "location": {
      "$ref": "https://awg.local/contracts/common/common.schema.json#/$defs/locationRef"
    },
    "fidelity": {
      "type": "number",
      "minimum": 0,
      "maximum": 1
    },
    "uncertainty": {
      "type": "number",
      "minimum": 0,
      "maximum": 1
    },
    "content": {
      "type": "object"
    },
    "access_path": {
      "type": "array",
      "minItems": 1,
      "items": {
        "type": "string"
      }
    }
  },
  "required": [
    "schema_version",
    "observation_id",
    "observer_id",
    "channel",
    "observed_at",
    "fidelity",
    "uncertainty",
    "content",
    "access_path"
  ],
  "additionalProperties": false
}
